{
  "kind": "e2e-test",
  "identity": "louke.contract.v0.14-002.e2e-test",
  "revision": "prism-round-3-remediation-candidate",
  "schema_ref": {"identity": "louke.machine-contract.e2e-test", "version": "1.0.0", "digest": "sha256:a12ebca80cc31997423ba5e602262804bde70456145bcf259f54482f1567b21c"},
  "manifest_ref": {"identity": "louke.design-artifacts.v0.14-002.prism-r3-remediation", "revision": "prism-round-3-remediation-candidate"},
  "scope": {"workspace_id": "github.com/zillionare/louke", "spec_id": "v0.14-002-workflow-reflow-design", "base_commit": "2734177ef5398e4c10a1f68039ec469ccc21f2b8", "project_facts_digest": "sha256:4b1a523c1cf946b480162e5321d3c92aeebdea75f57d5768948aee6f76672130", "project_facts_artifact": {"kind": "host-project-facts-snapshot", "path": "design-artifacts/inputs/host-project-facts.snapshot.json", "identity": "louke.host-project-facts.github.com-zillionare-louke", "revision": "base-2734177-workspace-2026-07-20-r2"}, "release_identity": "0.14.0"},
  "generated_by": {"owner": "Runtime/program", "role": "Archer", "task_manifest_digest": "sha256:0a9d58474340e9520af49d2bea462c41533c1fabc81afbcf4f5f292caecefbfc", "task_manifest_artifact": {"kind": "archer-author-task-manifest", "path": "design-artifacts/inputs/archer-author-task-manifest.candidate.json", "identity": "runtime.v0.14-002.m-design.archer.prism-r3-remediation", "revision": "prism-round-3-remediation-candidate"}}, "compatible_runtime": ">=0.14.0,<0.15.0",
  "artifact_refs": [
    {"path": ".louke/project/specs/v0.14-002-workflow-reflow-design/test-plan.md", "digest": "sha256:02a928e09f4abc80ae6ec0c60ec39ba33a131cfd5acc47dc3daeeab97cb4d53e", "ac_ids": ["AC-FR0300-01","AC-FR0600-01","AC-FR0900-01","AC-FR2050-01","AC-FR2400-01","AC-FR2500-01","AC-FR2700-01","AC-NFR0400-01","AC-NFR0500-01"], "interface_ids": ["IF-DES-01","IF-DES-02","IF-CON-01","IF-TST-01","IF-PRM-01","IF-REV-01","IF-WEB-01","IF-AUD-01"], "architecture_anchors": ["ARC-WEB","ARC-DESIGN","ARC-CONTRACTS","ARC-VALIDATE","ARC-PROMPTS","ARC-CI","ARC-REVIEW","ARC-STORE","ARC-MIGRATION","ARC-SECURITY"], "contract_kind": "e2e-test"},
    {"path": ".louke/project/specs/v0.14-002-workflow-reflow-design/interfaces.md", "digest": "sha256:ce4e83ae0d0f614a43a1912e317859105f84f08ba53fc3e8b1cc150dd108e37f", "ac_ids": ["AC-FR0600-01","AC-FR0900-01","AC-FR2400-01","AC-NFR0500-01"], "interface_ids": ["IF-TST-01","IF-WEB-01","IF-DES-01"], "architecture_anchors": ["ARC-WEB","ARC-DESIGN","ARC-CONTRACTS"], "contract_kind": "e2e-test"},
    {"path": ".louke/project/specs/v0.14-002-workflow-reflow-design/architecture.md", "digest": "sha256:32c88eb2062eb0173738086202eddf87122204ee99d32133c1ea30a6c39335cc", "ac_ids": ["AC-FR0900-01","AC-FR2050-01","AC-NFR0400-01"], "interface_ids": ["IF-TST-01","IF-PRM-01","IF-AUD-01"], "architecture_anchors": ["ARC-CONTRACTS","ARC-PROMPTS","ARC-STORE","ARC-SECURITY"], "contract_kind": "e2e-test"}
  ],
  "payload": {
    "commands": [{"id": "e2e-public", "cwd": ".", "command": "tests/e2e/run-project-venv e2e --profile all --runtime both", "implementation_state": "candidate-change-required", "success": "install, chromium and design-contracts profiles run for required installed-wheel runtimes; nine E-layer ACs pass with visible Workbench evidence and teardown", "failure": "Missing/unknown profile/runtime,path,node,AC-layer,ready,skip,not-run,test,timeout,cancel,evidence or teardown returns nonzero"}],
    "paths": ["tests/e2e/install_experience","tests/e2e/test_v013_chromium_journey_e2e.py","tests/e2e/v014_design_contracts","tests/fixtures/v014_design_contracts","tests/ground_truth/v014_design_contracts"], "discovery": {"profiles": ["install","chromium","design-contracts","all"], "all_expansion": ["install","chromium","design-contracts"], "runtimes": ["local","global","both"], "zero_collection": "nonzero"}, "runner": "tests/e2e/run-project-venv", "setup": ["build wheel", "create isolated installed local/global product venv", "install Playwright 1.54.0 bundled Chromium"], "run": "tests/e2e/run-project-venv e2e --profile all --runtime both",
    "services": [{"id": "workbench", "start": "lk web --host 127.0.0.1 --port <allocated-port>", "runtime": "installed wheel product venv"}], "ready": {"request": "GET /health", "interval_ms": 250, "timeout_seconds": 60, "expected": "HTTP 200 and installed version 0.14.0"}, "fixtures": ["approved_design_inputs","prompt_matrix","review_restart_matrix","secret_canaries"], "environment": {"HOME_XDG_workspace": "per profile/runtime temporary", "production_secrets": false, "providers": "stand-ins"}, "timeout_seconds": 2400,
    "suites": [{"id": "v014-design-contracts-e2e", "required": true, "paths": ["tests/e2e/v014_design_contracts"], "ac_ids": ["AC-FR0300-01","AC-FR0600-01","AC-FR0900-01","AC-FR2050-01","AC-FR2400-01","AC-FR2500-01","AC-FR2700-01","AC-NFR0400-01","AC-NFR0500-01"], "interface_ids": ["IF-DES-01","IF-TST-01","IF-PRM-01","IF-REV-01","IF-WEB-01","IF-AUD-01"], "architecture_anchors": ["ARC-WEB","ARC-DESIGN","ARC-PROMPTS","ARC-REVIEW","ARC-STORE","ARC-SECURITY"]}],
    "public_surfaces": ["Workbench current Project M-DESIGN context","GET /api/v14/runs/{run_id}/design","GET /api/v14/runs/{run_id}/design/audit"],
    "journeys": [
      {"id": "design-author-review-continue", "entry": "approved requirements current opens M-DESIGN", "actions": ["observe exact identities", "inspect docs/contracts/prompts/checks", "exercise comment/direct-diff/reconnect", "observe independent Prism result", "continue after baseline"], "visible_result": "ready_for_implementation with fresh program checks and trusted Prism identity; no second Human lock", "recovery": "stale/conflict preserves draft and current revision; failure links exact artifact anchor", "ac_ids": ["AC-FR0300-01","AC-FR0600-01","AC-FR0900-01","AC-FR2400-01","AC-FR2500-01","AC-FR2700-01","AC-NFR0500-01"]},
      {"id": "candidate-bootstrap-restart", "entry": "active bundle plus prompt candidate visible", "actions": ["verify current attempt stays active", "review with prior trusted Prism", "simulate restart before activation"], "visible_result": "candidate remains non-active until all prerequisites, then one atomic future activation; audit recovers identity", "recovery": "drift or kill keeps old active and marks candidate/review stale", "ac_ids": ["AC-FR2050-01","AC-NFR0400-01"]}
    ],
    "isolation": {"ports": "dynamically allocated", "browser_context": "new per case", "active_pointer": "fixture-local", "provider_namespace": "unique", "parallel_shared_state": false}, "artifacts": ["JUnit","v014-runner-evidence.json","Playwright trace on failure","DOM snapshot","redacted server log"], "evidence": {"required_ac_layer_reconciliation": true, "active_candidate_identity": true, "secret_scan_before_upload": true}, "teardown": ["save redacted evidence","TERM process group","wait 10 seconds","KILL if needed","remove temporary state"],
    "failure_policy": {"fail_closed": true, "non_success": ["failure","cancel","timeout","missing","skip","not-run","unknown","zero-collection","ready-failure","teardown-failure","evidence-mismatch"], "current_state": "candidate-not-installed"}
  }
}
